{
  "colors": {
    "bg": "#ffffff",
    "surface": "#f6f8fb",
    "ink": "#14171a",
    "muted": "#5b6470",
    "line": "#e3e7ec",
    "accent": "#2f6df6",
    "accent-deep": "#1e4fd0"
  },
  "type": {
    "hero": { "font": "Inter", "weight": 800 },
    "slab": { "font": "Inter", "weight": 700 },
    "mono": { "font": "Space Mono", "weight": 400 },
    "body": { "font": "Inter", "weight": 400 }
  },
  "motion": {
    "fps": 30,
    "eases": [
      "power2.out",
      "power3.out",
      "power3.in",
      "sine.inOut",
      "expo.out",
      "none"
    ],
    "budget": {
      "max_shader_transitions": 1,
      "transition_overlap_sec": [0.2, 0.35],
      "alive_always_on": false
    }
  },
  "textures": ["soft-shadow", "grid"]
}
